{
  "$defs": {
    "SuiteSpec": {
      "additionalProperties": true,
      "properties": {
        "file": {
          "anyOf": [
            {
              "type": "string"
            },
            {
              "type": "null"
            }
          ],
          "default": null,
          "title": "File"
        },
        "generation_mode": {
          "anyOf": [
            {
              "type": "string"
            },
            {
              "type": "null"
            }
          ],
          "default": null,
          "title": "Generation Mode"
        },
        "module_id": {
          "anyOf": [
            {
              "type": "string"
            },
            {
              "type": "null"
            }
          ],
          "default": null,
          "title": "Module Id"
        },
        "spec_id": {
          "title": "Spec Id",
          "type": "string"
        },
        "status": {
          "anyOf": [
            {
              "type": "string"
            },
            {
              "type": "null"
            }
          ],
          "default": null,
          "title": "Status"
        },
        "tier_used": {
          "anyOf": [
            {
              "type": "integer"
            },
            {
              "type": "null"
            }
          ],
          "default": null,
          "title": "Tier Used"
        }
      },
      "required": [
        "spec_id"
      ],
      "title": "SuiteSpec",
      "type": "object"
    }
  },
  "$id": "mta://schemas/test_suite.v2.schema.json",
  "$schema": "https://json-schema.org/draft/2020-12/schema",
  "additionalProperties": true,
  "properties": {
    "artifact": {
      "const": "test_suite",
      "default": "test_suite",
      "title": "Artifact",
      "type": "string"
    },
    "new_additions": {
      "anyOf": [
        {},
        {
          "type": "null"
        }
      ],
      "default": null,
      "title": "New Additions"
    },
    "project": {
      "anyOf": [
        {
          "type": "string"
        },
        {
          "type": "null"
        }
      ],
      "default": null,
      "title": "Project"
    },
    "schema_version": {
      "const": 2,
      "default": 2,
      "title": "Schema Version",
      "type": "integer"
    },
    "specs": {
      "items": {
        "$ref": "#/$defs/SuiteSpec"
      },
      "title": "Specs",
      "type": "array"
    },
    "total_scenarios": {
      "anyOf": [
        {
          "type": "integer"
        },
        {
          "type": "null"
        }
      ],
      "default": null,
      "title": "Total Scenarios"
    },
    "updated_at": {
      "anyOf": [
        {
          "type": "string"
        },
        {
          "type": "null"
        }
      ],
      "default": null,
      "title": "Updated At"
    }
  },
  "title": "TestSuiteV2",
  "type": "object",
  "x-mta-artifact": "test_suite",
  "x-mta-kind": "dict"
}
