{
  "specs": [
    {
      "spec_id": "BS-001",
      "module_id": "M01",
      "module_name": "Login",
      "scenario_title": "Standard user successfully logs into the system",
      "file": "M01/test_BS-001_standard_user_successfully_logs_into_the_system.spec.ts",
      "status": "new",
      "tier_used": 0,
      "fallback_route": null,
      "generated_at": "2026-06-29T12:51:18.225948+00:00",
      "last_run": null,
      "last_result": null
    },
    {
      "spec_id": "BS-002",
      "module_id": "M01",
      "module_name": "Login",
      "scenario_title": "Guest user accesses login page",
      "file": "M01/test_BS-002_guest_user_accesses_login_page.spec.ts",
      "status": "new",
      "tier_used": 0,
      "fallback_route": null,
      "generated_at": "2026-06-29T12:51:40.846168+00:00",
      "last_run": null,
      "last_result": null
    },
    {
      "spec_id": "BS-003",
      "module_id": "M01",
      "module_name": "Login",
      "scenario_title": "Automated test validates login functionality",
      "file": "M01/test_BS-003_automated_test_validates_login_functionality.spec.ts",
      "status": "new",
      "tier_used": 0,
      "fallback_route": null,
      "generated_at": "2026-06-29T12:52:05.585494+00:00",
      "last_run": null,
      "last_result": null
    },
    {
      "spec_id": "BS-004",
      "module_id": "M02",
      "module_name": "Inventory / Products",
      "scenario_title": "Remove Product from Shopping Cart",
      "file": "M02/test_BS-004_remove_product_from_shopping_cart.spec.ts",
      "status": "new",
      "tier_used": 0,
      "fallback_route": null,
      "generated_at": "2026-07-06T09:01:57.914985+00:00",
      "last_run": null,
      "last_result": null
    },
    {
      "spec_id": "BS-005",
      "module_id": "M02",
      "module_name": "Inventory / Products",
      "scenario_title": "Sort Products Alphabetically A to Z",
      "file": "M02/test_BS-005_sort_products_alphabetically_a_to_z.spec.ts",
      "status": "new",
      "tier_used": 0,
      "fallback_route": null,
      "generated_at": "2026-07-06T09:02:31.370446+00:00",
      "last_run": null,
      "last_result": null
    },
    {
      "spec_id": "BS-006",
      "module_id": "M02",
      "module_name": "Inventory / Products",
      "scenario_title": "Sort Products Alphabetically Z to A",
      "file": "M02/test_BS-006_sort_products_alphabetically_z_to_a.spec.ts",
      "status": "new",
      "tier_used": 0,
      "fallback_route": null,
      "generated_at": "2026-07-06T09:03:12.688400+00:00",
      "last_run": null,
      "last_result": null
    },
    {
      "spec_id": "BS-007",
      "module_id": "M02",
      "module_name": "Inventory / Products",
      "scenario_title": "Sort Products by Price Low to High",
      "file": "M02/test_BS-007_sort_products_by_price_low_to_high.spec.ts",
      "status": "new",
      "tier_used": 0,
      "fallback_route": null,
      "generated_at": "2026-07-06T09:03:53.767671+00:00",
      "last_run": null,
      "last_result": null
    },
    {
      "spec_id": "BS-008",
      "module_id": "M02",
      "module_name": "Inventory / Products",
      "scenario_title": "Sort Products by Price High to Low",
      "file": "M02/test_BS-008_sort_products_by_price_high_to_low.spec.ts",
      "status": "new",
      "tier_used": 0,
      "fallback_route": null,
      "generated_at": "2026-07-06T09:04:36.760205+00:00",
      "last_run": null,
      "last_result": null
    },
    {
      "spec_id": "BS-009",
      "module_id": "M02",
      "module_name": "Inventory / Products",
      "scenario_title": "Navigate to Product Details Page",
      "file": "M02/test_BS-009_navigate_to_product_details_page.spec.ts",
      "status": "new",
      "tier_used": 0,
      "fallback_route": null,
      "generated_at": "2026-07-06T09:05:12.065086+00:00",
      "last_run": null,
      "last_result": null
    },
    {
      "spec_id": "BS-010",
      "module_id": "M02",
      "module_name": "Inventory / Products",
      "scenario_title": "Access Shopping Cart Page",
      "file": "M02/test_BS-010_access_shopping_cart_page.spec.ts",
      "status": "new",
      "tier_used": 0,
      "fallback_route": null,
      "generated_at": "2026-07-06T09:05:44.182665+00:00",
      "last_run": null,
      "last_result": null
    },
    {
      "spec_id": "BS-011",
      "module_id": "M02",
      "module_name": "Inventory / Products",
      "scenario_title": "Open Navigation Menu",
      "file": "M02/test_BS-011_open_navigation_menu.spec.ts",
      "status": "new",
      "tier_used": 0,
      "fallback_route": null,
      "generated_at": "2026-07-06T09:06:17.021172+00:00",
      "last_run": null,
      "last_result": null
    },
    {
      "spec_id": "BS-012",
      "module_id": "M02",
      "module_name": "Inventory / Products",
      "scenario_title": "Logout from Application",
      "file": "M02/test_BS-012_logout_from_application.spec.ts",
      "status": "new",
      "tier_used": 0,
      "fallback_route": null,
      "generated_at": "2026-07-06T09:06:48.015253+00:00",
      "last_run": null,
      "last_result": null
    },
    {
      "spec_id": "BS-013",
      "module_id": "M02",
      "module_name": "Inventory / Products",
      "scenario_title": "Verify Cart Persistence During Interface Interactions",
      "file": "M02/test_BS-013_verify_cart_persistence_during_interface_interactions.spec.ts",
      "status": "new",
      "tier_used": 0,
      "fallback_route": null,
      "generated_at": "2026-07-06T09:07:31.219375+00:00",
      "last_run": null,
      "last_result": null
    },
    {
      "spec_id": "BS-014",
      "module_id": "M02",
      "module_name": "Inventory / Products",
      "scenario_title": "Maintain Cart State After Page Refresh",
      "file": "M02/test_BS-014_maintain_cart_state_after_page_refresh.spec.ts",
      "status": "new",
      "tier_used": 0,
      "fallback_route": null,
      "generated_at": "2026-07-06T09:08:11.582152+00:00",
      "last_run": null,
      "last_result": null
    }
  ],
  "project": "sauceLabs",
  "updated_at": "2026-07-06T09:08:11.582178+00:00",
  "total_scenarios": 14,
  "new_additions": [
    "M01/test_BS-001_standard_user_successfully_logs_into_the_system.spec.ts",
    "M01/test_BS-002_guest_user_accesses_login_page.spec.ts",
    "M01/test_BS-003_automated_test_validates_login_functionality.spec.ts",
    "M02/test_BS-004_remove_product_from_shopping_cart.spec.ts",
    "M02/test_BS-005_sort_products_alphabetically_a_to_z.spec.ts",
    "M02/test_BS-006_sort_products_alphabetically_z_to_a.spec.ts",
    "M02/test_BS-007_sort_products_by_price_low_to_high.spec.ts",
    "M02/test_BS-008_sort_products_by_price_high_to_low.spec.ts",
    "M02/test_BS-009_navigate_to_product_details_page.spec.ts",
    "M02/test_BS-010_access_shopping_cart_page.spec.ts",
    "M02/test_BS-011_open_navigation_menu.spec.ts",
    "M02/test_BS-012_logout_from_application.spec.ts",
    "M02/test_BS-013_verify_cart_persistence_during_interface_interactions.spec.ts",
    "M02/test_BS-014_maintain_cart_state_after_page_refresh.spec.ts"
  ]
}