{
  "specs": [
    {
      "spec_id": "GEN_BS_001",
      "module_id": "M01",
      "module_name": "Home",
      "scenario_title": "Toggle Application Theme using Dark Mode Switch",
      "file": "M01/test_GEN_BS_001_toggle_application_theme_using_dark_mode_switch.spec.ts",
      "status": "new",
      "tier_used": 0,
      "fallback_route": null,
      "generation_mode": "action_library",
      "generated_at": "2026-09-17T14:01:13.894854+00:00",
      "last_run": null,
      "last_result": null
    },
    {
      "spec_id": "GEN_BS_002",
      "module_id": "M01",
      "module_name": "Home",
      "scenario_title": "Open Demo Project",
      "file": "M01/test_GEN_BS_002_open_demo_project.spec.ts",
      "status": "new",
      "tier_used": 0,
      "fallback_route": null,
      "generation_mode": "action_library",
      "generated_at": "2026-09-17T14:02:27.405657+00:00",
      "last_run": null,
      "last_result": null
    },
    {
      "spec_id": "GEN_BS_003",
      "module_id": "M01",
      "module_name": "Home",
      "scenario_title": "Access BRD Compliance Criterion Level View",
      "file": "M01/test_GEN_BS_003_access_brd_compliance_criterion_level_view.spec.ts",
      "status": "new",
      "tier_used": 0,
      "fallback_route": null,
      "generation_mode": "action_library",
      "generated_at": "2026-09-17T14:03:44.063232+00:00",
      "last_run": null,
      "last_result": null
    },
    {
      "spec_id": "M01_BS_001",
      "module_id": "M01",
      "module_name": "Home",
      "scenario_title": "Switch Application Theme to Dark Mode",
      "file": "M01/test_M01_BS_001_switch_application_theme_to_dark_mode.spec.ts",
      "status": "new",
      "tier_used": 0,
      "fallback_route": null,
      "generation_mode": "action_library",
      "generated_at": "2026-09-17T14:05:58.817545+00:00",
      "last_run": "2026-09-23",
      "last_result": "failed"
    },
    {
      "spec_id": "M01_BS_002",
      "module_id": "M01",
      "module_name": "Home",
      "scenario_title": "Open Demo Project",
      "file": "M01/test_M01_BS_002_open_demo_project.spec.ts",
      "status": "new",
      "tier_used": 0,
      "fallback_route": null,
      "generation_mode": "action_library",
      "generated_at": "2026-09-17T14:07:12.441421+00:00",
      "last_run": "2026-09-23",
      "last_result": "failed"
    },
    {
      "spec_id": "M01_BS_003",
      "module_id": "M01",
      "module_name": "Home",
      "scenario_title": "Access BRD Compliance Criterion Level View",
      "file": "M01/test_M01_BS_003_access_brd_compliance_criterion_level_view.spec.ts",
      "status": "new",
      "tier_used": 0,
      "fallback_route": null,
      "generation_mode": "action_library",
      "generated_at": "2026-09-17T14:08:31.685507+00:00",
      "last_run": "2026-09-23",
      "last_result": "failed"
    },
    {
      "spec_id": "GEN_BS_004",
      "module_id": "M01",
      "module_name": "Home",
      "scenario_title": "Create a New Project",
      "file": "M01/test_GEN_BS_004_create_a_new_project.spec.ts",
      "status": "new",
      "tier_used": 0,
      "fallback_route": null,
      "generation_mode": "action_library",
      "generated_at": "2026-09-23T10:39:06.946583+00:00",
      "last_run": null,
      "last_result": null
    },
    {
      "spec_id": "M01_BS_004",
      "module_id": "M01",
      "module_name": "Home",
      "scenario_title": "Create New Project",
      "file": "M01/test_M01_BS_004_create_new_project.spec.ts",
      "status": "new",
      "tier_used": 0,
      "fallback_route": null,
      "generation_mode": "action_library",
      "generated_at": "2026-09-23T10:40:14.230083+00:00",
      "last_run": "2026-09-23",
      "last_result": "failed"
    },
    {
      "spec_id": "M01_BS_005",
      "module_id": "M01",
      "module_name": "Home",
      "scenario_title": "Delete Item or Resource",
      "file": "M01/test_M01_BS_005_delete_item_or_resource.spec.ts",
      "status": "new",
      "tier_used": 0,
      "fallback_route": null,
      "generation_mode": "action_library",
      "generated_at": "2026-09-23T10:41:32.671932+00:00",
      "last_run": "2026-09-23",
      "last_result": "failed"
    },
    {
      "spec_id": "M01_BS_006",
      "module_id": "M01",
      "module_name": "Home",
      "scenario_title": "Access Shopflow Demo",
      "file": "M01/test_M01_BS_006_access_shopflow_demo.spec.ts",
      "status": "new",
      "tier_used": 0,
      "fallback_route": null,
      "generation_mode": "action_library",
      "generated_at": "2026-09-23T10:42:32.755217+00:00",
      "last_run": "2026-09-23",
      "last_result": "failed"
    },
    {
      "spec_id": "M01_BS_007",
      "module_id": "M01",
      "module_name": "Home",
      "scenario_title": "Execute Open Action",
      "file": "M01/test_M01_BS_007_execute_open_action.spec.ts",
      "status": "new",
      "tier_used": 0,
      "fallback_route": null,
      "generation_mode": "action_library",
      "generated_at": "2026-09-23T10:43:54.760889+00:00",
      "last_run": "2026-09-23",
      "last_result": "failed"
    }
  ],
  "project": "App_Compliance_with_docs",
  "updated_at": "2026-09-23T10:43:54.760889+00:00",
  "total_scenarios": 11,
  "new_additions": [
    "M01/test_GEN_BS_001_toggle_application_theme_using_dark_mode_switch.spec.ts",
    "M01/test_GEN_BS_002_open_demo_project.spec.ts",
    "M01/test_GEN_BS_003_access_brd_compliance_criterion_level_view.spec.ts",
    "M01/test_M01_BS_001_switch_application_theme_to_dark_mode.spec.ts",
    "M01/test_M01_BS_002_open_demo_project.spec.ts",
    "M01/test_M01_BS_003_access_brd_compliance_criterion_level_view.spec.ts",
    "M01/test_GEN_BS_004_create_a_new_project.spec.ts",
    "M01/test_M01_BS_004_create_new_project.spec.ts",
    "M01/test_M01_BS_005_delete_item_or_resource.spec.ts",
    "M01/test_M01_BS_006_access_shopflow_demo.spec.ts",
    "M01/test_M01_BS_007_execute_open_action.spec.ts"
  ]
}