{
  "specs": [
    {
      "spec_id": "M01_BS_001",
      "module_id": "M01",
      "module_name": "Homepage",
      "scenario_title": "Access Gemini Home Page Interface",
      "file": "M01/test_M01_BS_001_access_gemini_home_page_interface.spec.ts",
      "status": "new",
      "tier_used": 0,
      "fallback_route": null,
      "generation_mode": "action_library",
      "generated_at": "2026-07-17T14:41:42.579034+00:00",
      "last_run": "2026-07-17",
      "last_result": "failed"
    },
    {
      "spec_id": "M01_BS_002",
      "module_id": "M01",
      "module_name": "Homepage",
      "scenario_title": "Enter Text into Prompt Interface",
      "file": "M01/test_M01_BS_002_enter_text_into_prompt_interface.spec.ts",
      "status": "new",
      "tier_used": 0,
      "fallback_route": null,
      "generation_mode": "action_library",
      "generated_at": "2026-07-17T14:42:04.249808+00:00",
      "last_run": "2026-07-17",
      "last_result": "passed"
    },
    {
      "spec_id": "M01_BS_006",
      "module_id": "M01",
      "module_name": "Homepage",
      "scenario_title": "Browse Available AI Models",
      "file": "M01/test_M01_BS_006_browse_available_ai_models.spec.ts",
      "status": "new",
      "tier_used": 0,
      "fallback_route": null,
      "generation_mode": "action_library",
      "generated_at": "2026-07-17T14:43:11.447216+00:00",
      "last_run": "2026-07-17",
      "last_result": "passed"
    },
    {
      "spec_id": "M01_BS_007",
      "module_id": "M01",
      "module_name": "Homepage",
      "scenario_title": "Switch AI Model",
      "file": "M01/test_M01_BS_007_switch_ai_model.spec.ts",
      "status": "new",
      "tier_used": 0,
      "fallback_route": null,
      "generation_mode": "action_library",
      "generated_at": "2026-07-17T14:43:17.283089+00:00",
      "last_run": "2026-07-17",
      "last_result": "failed"
    },
    {
      "spec_id": "M01_BS_008",
      "module_id": "M01",
      "module_name": "Homepage",
      "scenario_title": "Access Upgrade Options",
      "file": "M01/test_M01_BS_008_access_upgrade_options.spec.ts",
      "status": "new",
      "tier_used": 0,
      "fallback_route": null,
      "generation_mode": "action_library",
      "generated_at": "2026-07-17T14:43:21.936845+00:00",
      "last_run": "2026-07-17",
      "last_result": "failed"
    },
    {
      "spec_id": "M01_BS_009",
      "module_id": "M01",
      "module_name": "Homepage",
      "scenario_title": "Toggle Sidebar Visibility",
      "file": "M01/test_M01_BS_009_toggle_sidebar_visibility.spec.ts",
      "status": "new",
      "tier_used": 0,
      "fallback_route": null,
      "generation_mode": "action_library",
      "generated_at": "2026-07-17T14:43:26.911467+00:00",
      "last_run": "2026-07-17",
      "last_result": "failed"
    },
    {
      "spec_id": "M01_BS_010",
      "module_id": "M01",
      "module_name": "Homepage",
      "scenario_title": "Start New Conversation",
      "file": "M01/test_M01_BS_010_start_new_conversation.spec.ts",
      "status": "new",
      "tier_used": 0,
      "fallback_route": null,
      "generation_mode": "action_library",
      "generated_at": "2026-07-17T14:43:31.988541+00:00",
      "last_run": "2026-07-17",
      "last_result": "failed"
    },
    {
      "spec_id": "M01_BS_011",
      "module_id": "M01",
      "module_name": "Homepage",
      "scenario_title": "Access Previous Conversations",
      "file": "M01/test_M01_BS_011_access_previous_conversations.spec.ts",
      "status": "new",
      "tier_used": 0,
      "fallback_route": null,
      "generation_mode": "action_library",
      "generated_at": "2026-07-17T14:43:36.087624+00:00",
      "last_run": "2026-07-17",
      "last_result": "failed"
    },
    {
      "spec_id": "M01_BS_012",
      "module_id": "M01",
      "module_name": "Homepage",
      "scenario_title": "Access Settings",
      "file": "M01/test_M01_BS_012_access_settings.spec.ts",
      "status": "new",
      "tier_used": 0,
      "fallback_route": null,
      "generation_mode": "action_library",
      "generated_at": "2026-07-17T14:43:40.500636+00:00",
      "last_run": "2026-07-17",
      "last_result": "passed"
    },
    {
      "spec_id": "M01_BS_013",
      "module_id": "M01",
      "module_name": "Homepage",
      "scenario_title": "Access Search Functionality",
      "file": "M01/test_M01_BS_013_access_search_functionality.spec.ts",
      "status": "new",
      "tier_used": 0,
      "fallback_route": null,
      "generation_mode": "action_library",
      "generated_at": "2026-07-17T14:43:50.954946+00:00",
      "last_run": "2026-07-17",
      "last_result": "passed"
    },
    {
      "spec_id": "M01_BS_014",
      "module_id": "M01",
      "module_name": "Homepage",
      "scenario_title": "Navigate Using Keyboard",
      "file": "M01/test_M01_BS_014_navigate_using_keyboard.spec.ts",
      "status": "new",
      "tier_used": 0,
      "fallback_route": null,
      "generation_mode": "action_library",
      "generated_at": "2026-07-17T14:43:56.963097+00:00",
      "last_run": "2026-07-17",
      "last_result": "passed"
    },
    {
      "spec_id": "M01_BS_015",
      "module_id": "M01",
      "module_name": "Homepage",
      "scenario_title": "Access Voice Input",
      "file": "M01/test_M01_BS_015_access_voice_input.spec.ts",
      "status": "new",
      "tier_used": 0,
      "fallback_route": null,
      "generation_mode": "action_library",
      "generated_at": "2026-07-17T14:44:01.701631+00:00",
      "last_run": "2026-07-17",
      "last_result": "passed"
    }
  ],
  "project": "geminiTest4",
  "updated_at": "2026-07-17T14:44:01.701654+00:00",
  "total_scenarios": 12,
  "new_additions": [
    "M01/test_M01_BS_001_access_gemini_home_page_interface.spec.ts",
    "M01/test_M01_BS_002_enter_text_into_prompt_interface.spec.ts",
    "M01/test_M01_BS_006_browse_available_ai_models.spec.ts",
    "M01/test_M01_BS_007_switch_ai_model.spec.ts",
    "M01/test_M01_BS_008_access_upgrade_options.spec.ts",
    "M01/test_M01_BS_009_toggle_sidebar_visibility.spec.ts",
    "M01/test_M01_BS_010_start_new_conversation.spec.ts",
    "M01/test_M01_BS_011_access_previous_conversations.spec.ts",
    "M01/test_M01_BS_012_access_settings.spec.ts",
    "M01/test_M01_BS_013_access_search_functionality.spec.ts",
    "M01/test_M01_BS_014_navigate_using_keyboard.spec.ts",
    "M01/test_M01_BS_015_access_voice_input.spec.ts"
  ]
}